name,text
Merton (YouTube),merton is an american youtube musician and personality who first gained press attention in march 2010 after making videos of himself interacting with people he meets on chatroulette and omegle in the videos merton sits at a piano and improvises songs about either his observations of the people he is meeting or story ideas suggested by themmertons first video garnered more 5 star ratings than any other youtube video in history making it the highest rated youtube video ever his musical style has been compared to randy newman and ben foldsmerton lives in colorado his real name is unknown he is a selftaught pianistthere was speculation that merton was in fact ben folds while the two have similarities in appearance and music style both have denied being the same person folds has in fact performed an homage to merton at a concert where he similarly improvised songs while meeting people on chatroulette on a later video of mertons ben folds and merton appeared together proving that they are not the same personmerton previously hosted his own show on wwwmertonshowcom it was a live interactive webcam show where he continued his improvisation as he did on chatroulette shows were every wednesday at 10 pm eastern time sometimes there was an international show at 2100 gmt 4 pm eastern merton was later hired by tmobile to do some public events in the united kingdom on november 24 2010 he played in gatwick airports south terminal greeting international arriving passengers with his improv piano playingas of 112014 merton is still doing his live interactive comedy show at httpwwwmertonshowcomas of august 2014 merton announced a hiatus from his showas of december 31 2014 the whereabouts of merton is unknown
Pacha Wazir,haji pacha wazir is an emirati citizen who ran a series of hawala banks before being arrested in 2003 amid accusations that he worked as the main banker for osama bin ladenthe canadian security intelligence service alleges that mohamed harkat was recorded on the phone with a haji wazir whom handled financial transactions for him and described his bid to gain permanent resident status in canadaaccording to rob suskind when wazir was arrested and sent to a central intelligence agency black site he proved uncooperative and american officials illegally transferred his brother from germany to the same site and arrested his branch manager in karachi members of the american central intelligence agency posed as distant cousins taking over the business after wazirs illness and continued financial transactions entrapping many of his colleagues as wellhowever in his book the interrogator an education glenn carle contradicts the claims suskind made about wazir carle was the cia officer who handled the interrogation of wazir and according to his account carle concluded after the interrogation that wazir cooperated and told the truth about his operations reporting on wazirs story after the publication of carles book scott horton for harpers magazine concludes the suggestion that pacha wazir was consciously managing bin ladens financial affairs was then and remains today utterly baseless perhaps the most shocking part of carles account is that his conclusions about wazir were ignored by his superiors at the cia as a result it was not until february 2010 was wazir released and sent home to afghanistan
Sam Ewang,group captain sam ewang was appointed military administrator of ogun state nigeria from august 1996 to august 1998 during the military regime of general sani abacha and then administrator of rivers state until may 1999 handing over power to the elected governor peter odili at the start of the nigerian fourth republicewang ran for governor of akwa ibom in april 2007 on the all nigeria peoples party anpp platform after the election he accused the peoples democratic party pdp and independent national electoral commission inec of rigging the resultsin november 2007 the anpp declared that the purported suspension of ewang its governorship candidate for akwa ibom state in the 2007 general elections was illegalin a june 2009 interview ewang held the present government of akwa ibom responsible for the recent spate of kidnappings robbery and hired killings accusing government agents of being involvedin february 2010 chris nyong ekong former commissioner for youths and sports in akwa ibom was arraigned for kidnap conspiracy and murder there had been a series of recent kidnappings ewang alleged that prominent ibibio people were being targetedewang is one of the leaders of the national democratic movement ndmin january 2010 the ndm was involved in talks with the mega party being planned by mohammadu buhari atiku abubakar olu falae bola tinubu and anthony enahoro with the purpose of defining a common platform to oppose the pdpewang was appointed to an integration committee that also included olu falae balarabe musa pat utomi and arthur nwakwo charged with ensuring the full coalition of all the parties and eminent stakeholders
Kenny Vasoli,kenneth robert kenny vasoli born may 20 1984 in abington pennsylvania is the lead singer and bassist of the starting line and vacationer vasoli attended hatborohorsham high school at the age of 14 he was invited to join the band after matt watts read his aol instant messenger profile his previous bands include the prize fight and smash adams in early 2004 vasoli also had a shortlived sideproject called statue with members of the prize fight and inklingon september 29 2010 it was announced on say anythings website that vasoli would be playing bass for them on their upcoming fall tour with motion city soundtrack and saves the day replacing exbassist alex kentkenny has performed guest vocals and played bass for many artists including the early november hot rod circuit the prize fight death in the park shadows in lakeland the almost the junior varsity hit the lights zolof the rock and roll destroyer mae valencia and say anything he provided guest vocals on the song so close by the pop punkhardcore band such gold from their 2010 release pedestals he is also the lead vocalist and guitarist in person l and most recently vacationer vasoli wrote a song titled yule be sorry with aaron gillespie the almost underoath for happy christmas vol 4 a collection of christmas songson may 28 2011 at slam dunk records leeds music festival the starting line played a 50minute set during which kenny vasoli announced people keep asking us when were getting back together and the answer i have is yesterday and what happens when bands get together they write music so we have a new song for you the song is entitled luck this announcement from vasoli finally puts to an end any speculation that the band were just back together for the occasional show his current band vacationer spent the spring of 2012 touring with the naked and famous
Anand Tummala,anand tummala born 21 october 1978 in vuyyuru andhra pradesh india also known as t anand is a cricketer for the united statesanand first appeared in the united states national cricket team as an allrounder in 2011 in the etihad t20 cricket tournament hosted by cricket canada in king city ontario 1113 august 2011 anand made an impression with his debut bowling figures of 3 over 1 maiden 10 runs 2 wickets against arch rivals canada anand bowled exceptionally well against trinidad tobago in the second match with figures of 2 for 24 in 4 oversanand went on to be part of usa cricket team in the historical ka auty trophy 2 day match played on 15 16 august 2011 held at toronto cricket skating curling club which dates back to 1844 between usa canada anands performance in the ka auty trophy was excellent with match bowling figures of 25 overs 97 runs 3 maidens and 3 wickets anand scored 88 runs in the match with 63 being his highest in the second innings which almost won the game for usaanand also played firstclass cricket in india ranji trophy for delhi in 200102 has also played premier league cricket in gwent glamorgan uk he completed his schooling from sardar patel vidyalaya new delhi college from st stephens college delhi universityanand also acquired his level i and level ii cricket coaching certifications from the england wales cricket board during his stay at the university of wales newport where he completed his mba in 2007 anand was appointed coach captain for the university of wales newport cricket team also went on to be signed as senior coach player for croesyceiliog cricket club in south wales premier league gwent glamorgan ukanand has also worked closely with bishan bedi former indian team coach captain while he represented bishan bedi cricket coaching trust teams in england australiaanand now plays for north atlanta cricket club in the atlanta georgia cricket conference agcc he has also represented south east region of usa where he has performed exceptionally wellreferences
Logan Sama,logan sama is an english grime dj from brentwood essex who currently hosts a show on londons kiss fm he also runs the record labels adamantium music and earth616 which specialise in vinyl releaseshe began his radio career on local pirate station plush fm hosting several cover shows playing underground garage in 2002 towards the end of 2002 he was recruited to london thenpirate station rinse fm where his show became a popular place to hear the newest music and regularly featured the biggest mcs performing live his last rinse show was captured on video on the rinsessions dvd and showcased such names as wiley skepta trim ruff sqwad tinchy stryder newham generals and many othershe moved to londons kiss 100 in the spring of 2005 and began a late night specialist grime show running from 24am on thursday nightfriday morning the popularity of this show soon saw it move to monday night 11pm1am where it has steadily grown to its current position as the leading show amongst young people within london at that time capturing over 61000 listeners in the greater london area as certified by rajar his exposure of live mix sets and first played new tracks has led to him becoming the leading figure in radio for grime music his shows are now also captured on video and streamed as youtube clips which have proved very popularthe show now is broadcast at 1am on monday and has become very popular on social networking site twitter using the hashtag kissgrime which has trended nationally with great frequency new additions to the show the versus sessions where an artist picks their favourite current beat and performs live as well as the after hours classic grime sets are also made available via his youtube channel keepinitgrimylogan has achieved a position of respect in the grime scene for his work since the foundations of the genre and this has been reflected with the multiple grime awards he has collected voted for by the fans he currently holds the record for most awards won by a single act with 7 separate wins
John Bienenstock,doctor john bienenstock b october 6 1936 is a hungarianborn canadian doctor he is considered one of the fathers of mucosal immunologyborn in budapest of jewish parents he escaped to england in 1939 with his parents he was educated at st pauls school in london and continued his studies at the university of london bienenstock came to the united states to pursue research projects but left for canada during the vietnam war rather than be drafted as an army doctor he joined mcmaster university in 1968 he served as dean of health sciences as vicepresident of the faculty of health sciences and as chair for the department of pathology and molecular medicine at mcmaster he has also served as president of the canadian society for immunology and of the society of mucosal immunology more recently he became head of the brainbody institute at st josephs healthcare hamiltonbienenstock introduced the concept of a common mucosal immune system he also studied the interactions between the nervous and immune systemshe is a member of the royal college of physicians uk bienenstock was named a fellow of the royal society of canada in 1992 and was named to the order of canada in 2002 bienenstock was inducted into the canadian medical hall of fame in 2011
Benjamin Diokno,benjamin diokno born march 31 1948 was secretary of budget and management of the philippines in the administration of president joseph estrada from july 1998 until estradas ouster in january 2001 diokno also served as undersecretary for budget operations at the department of budget and management from 1986 to 1991 during the administration of president corazon aquinoduring the aquino administration diokno provided technical assistance to several major reforms such as the design of the 1986 tax reform program which simplified income tax and introduced the valueadded tax vat and the 1991 local government code of the philippinesduring the estrada administration diokno initiated and instituted several reforms that would enhance transparency and improve the efficiency of the delivery of government services the first major reform instituted was the what you see is what you get or wyswig policy that is a simplified system of fund release for the general appropriations act gaa this allowed agency heads to immediately plan and contract out projects by just looking at the gaa which is available in print and at the dbm website without waiting for the issuance of an allotment authority diokno initiated the reform of the government procurement system gps through the adoption of rapidly improving information and communications technology he secured technical assistance from the canadian international development agency cida to help the gps develop an electronic procurement system along the lines of the canadian model by august 1999 the dbm had two documents necessary to initiate reforms in public procurement in early 2000 diokno and usaid successfully concluded a substantial technical assistance program for the dbms budget reform programs which now included procurement reform other budget reforms instituted by diokno concerned procedures for payment of accounts payable and terminal leave retirement gratuity benefits the release of cash allocation were programmed and uploaded to the departments website while payments were made direct to the bank accounts of specific contractorthe growing budget deficit was of large concern during dioknos tenure with the national economic and development authority director citing it as the governments biggest problem the government ended 1999 with a budget deficit of p114 billion overshooting its target of p101 billion which had previously been increased from an original target of p684 billion the government missed its target by a far wider margin the next year set an original deficit target of p625 billion for 2000 yet occurring a fullyear deficit of p130 billion this is higher than the p1265 billion worstcase scenario figure from the international monetary funddiokno is currently a professor at the university of the philippines school of economics he is also a columnist for business world he was born in taal batangas
Stu Pflaum,stuart pflaum better known as dj xplosive is an american music industry figure and digital music pioneer pflaum was born june 29 1981 in nashville tn based in new york city pflaum previously worked as consultant to street teams and lifestyle promotions at asylum records and warner music group pflaum founded the element 9 company in 2005 to assist in the development of independent musicians 1in 2007 pflaum began working with teen hiphop sensation soulja boy tellem as his music publisher and head of online promotions at the age of 26 pflaum was nominated for a grammy award for his role in publishing soulja boys material 2pflaum published the hiphop stimulus plan in february 2009 a series of writings that explore the role of the internet in the modern music industry 3 in november 2009 the element 9 company partnered with fontana distribution the independent distribution arm of universal music group to release albums from artists signed to the companys record label 4 pflaum will serve as vice president for the label in 2010 element 9 announced a deal with blacksmith records to release a series of albums with the label headed by talib kweli their first release will be the album arms hammers by west coast hip hop trio strong arm steady 5 the album will be released in february 2011
Kamran Shirazi,kamran shirazi born 21 november 1952 is an international master of chess born in tehran he has represented iran the united states and france he moved to the united states in the late 1970s and quickly became one of the most active players in the country winning many tournaments including the southern california open five times the world open tied for first in 1983 the national open tied for first in 1985 and the memorial day classic tied for first in 1986he was known for playing strange and unorthodox openings shirazis rating rose rapidly and he became one of the highest rated players in the united states chess federation however when invited to play in the 1984 us chess championship shirazi managed only one draw from 17 games finishing last in that championship shirazi also achieved the dubious distinction of losing the shortest decisive game in the history of the us championship his game as white against john peters which went 1e4 c5 2b4 cxb4 3a3 d5 4exd5 qxd5 5axb4 qe5 01he subsequently made an appearance in the movie searching for bobby fischer he is introduced as grandmaster shirazi but his actual title is international master awarded in 1978as of 2006 shirazi had been living in france for several years he is still an active tournament player and also gives lessons he changed his fide federation from the usa to france in 2006on the september 2009 fide list he has an elo rating of 2410
Tony Barber (musician),anthony arthur barber known as tony barber born 3 december 1942 norwich norfolk is an englishborn australian public speaker and a diverse innovative creator musiciansingersongwriterauthorplush toy designergift and craft tool product designer paper sculpturist artist teacher and mentor he arrived in australia in 1963he was a member of the band billy thorpe the aztecs in the 1960s and then as a solo artist he wrote 35 childrens books under the name a a barber and tony barber and appeared on the childrens television show the music shop as tony the toymaker in 2009 he theorized that if you were to re design the traditional a and h frame easels to a stage where you removed all the visual and physical impediments and barriers that those easels place in front of an artist not only would all artists feel better when they painted but their art would actually improve he then proceeded to prove this theory to be true by inventing a totally new type of easel he called the artristic easel artists that use it say it is a revolutionary and indispensable piece of artists equipment and is the most versatile easel in the history of art a popular fantasy character he created named designed the soft toy of and that appeared in many of his books was taken and used to name the australian baby echidna
Ellie Paskell,ellie paskell born 1986 in prestwich greater manchester is a british actress who trained at guildford school of acting she began acting when aged 11 she joined the carol godby theatre workshoppaskell is best known for playing maxine barlow in the bbc one hit series waterloo road she joined the show at the start of 2007 early in series 2 as a 15yearold dropout who was living rough as a drug addict and was introduced to the series at the girlfriend of expelled pupil lewis seddon played by craig fitzpatrick the character returned to school and was involved in numerous high profile storylines including exposing her mothers boyfriend as a serial sex attacker moving into the home of french teacher steph haydock played by denise welch overcoming drug addiction the tragic find of a babys body in the school playing field which turned out to be maxines her character met a tragic end in series 4 when maxine was fatally shot by boyfriend earl kelly played by reece noion stage paskell has performed in one night in november she also played a minor part in the second series of ashes to ashes since then she appeared in casualty as a youth who was hurt in an explosion and also as julie stanlake a teenager who gave birth early and dumped her baby in a dustbin in another episodeshe also worked with david threlfall and the rest of the shameless cast when she filmed three episodes of the hit comedy drama as bubbly sammy dee she played a teaching assistant at brecknock primary school in london and had a small role in the bill as a drug addict who sold her baby
Abbas Suan,abbas suan sometimes spelled suwan or swan arabic hebrew born january 27 1976 is an arabisraeli footballer from sakhnin in the galilee as a footballer he was considered by many as one of the best arabisraeli playershe became a national hero in 2006 for scoring the gametying goal in the 90th minute of a world cup qualifying match against irelandin 2006 suan signed a twoyear contract with maccabi haifa but later moved to premier league newcomers ironi kiryat shmona he returned to play for his original club bnei sakhnin on august 29 2005 suan was featured in an expos in sports illustrated by grant wahl into the minorities that play on the israel national football team suan has been the target of racism at football matches in israel during a match between bnei sakhnin and betar jerusalem betar fans waved a giant banner saying suan you dont represent us and shouted we hate all arabs suan is also a featured subject of the documentary film after the cupsons of sakhnin united which chronicled the team and suans life after winning the israeli national cupaside from his club contract he has many endorsement deals suan currently is the spokesperson for subaru motor vehicles in israel although a devout muslim suan has no trouble embracing jewish culture in israel however he has a mixed sense of identity saying that i am a palestinian because i have a lot of brothers and cousins in the arab countries and i am israeli because i live here and dont go out of my lands during international football matches suan is one of two arab players who refuse to sing during the playing of hatikvah israels national anthem because it mentions only jews he was featured in a journeyman pictures documentary on arab citizens of israel
Kenneth F. Warren,dr kenneth f warren is an authority on politics public administration and administrative law within the united states warren is a professor of political science at saint louis university and the president of the warren poll warren has polled for various media government and political clients including former house minority leader richard gephardtwarren served as a political analyst for local national and international media for over 20 years he has appeared live on cnn cbs abc msnbc bbc cbc swedish television and fox news the new york times st louis post dispatch the washington post usa today the times the wall street journal the new republic the national journal the economist and time magazine have used warrens work as a political analyst frequently warren appears as a political analyst on national public radio nprwarren authored in defense of public opinion polling which became globally popular after its release in 2001 and administrative law in the american political system published originally in 1982 with a fourth edition published in 2004warren as president of the warren poll has been conducting surveys for political candidates cities school districts nonprofit organizations states the media and private clients since 1980 and has specialized in community surveys since the late 1980s conducting citizen surveys as well as employee and business surveys for many cities in the st louis areadr kenneth f warren received his phd from the university of massachusetts amherst
"Constantine Phipps, 5th Marquess of Normanby",constantine edmund walter phipps 5th marquess of normanby born 24 february 1954 is the son of oswald phipps 4th marquess of normanby and grania guinness he was educated at worcester college oxfordlord normanby lives at mulgrave castlein 1990 he married nicola shulman daughter of theatre critic milton shulman and sister of british vogue editor alexandra shulman and had three childrenlady sibylla victoria evelyn phipps b 6 august 1992john samuel constantine phipps earl of mulgrave b 26 november 1994lord thomas henry winston phipps b 3 june 1997he succeeded his father in the marquessate in 1994 and entered the house of lords as a crossbencher he lost his seat under the house of lords act 1999in 1998 he sold the 10600acre 43 km2 warter priory estate near pocklington east riding of yorkshire to businessman malcolm healey for 48 million in 2003 supermodel elle macpherson took out a lease on the 16000acre 65 km2 mulgrave estate in north yorkshire considered one of englands finest shooting estates including the right to live in the familys ancestral home mulgrave castle during the fourmonth shooting season the 5th marquess was ranked 279th in the sunday times rich list 2004 with an estimated wealth of 143m his indirect wealth includes a sizeable interest in property in west vancouver canada via british pacific properties ltdjohn samuel constantine remains the heir apparent and will take up permanent residence in mulgrave castle upon the death of his father
