name,text
Krishna Bhatt,krishna mohan bhatt hindi born 1949 is a sitar player teacher and scholar from jaipur indiahe comes from a family of musicians in jaipur his father the late shashi mohan bhatt a sitarist of great repute and a professor at the university of rajasthan jaipur trained many musicians in the family including krishna bhatt manju mehta in ahmedabad and vishwa mohan bhatt krishna bhatts forefathers migrated from the south of india andhra pradesh to the state of rajasthan in the northwest a princely state then to seek employment in the gunijankhn department of learned scholars of the maharaja of jaipur they were sanskrit scholars poets and musiciansin his teens krishnas musical grooming was further enhanced by many years of study under the tutelage of his guru pt ravi shankar and musicians pt nikhil banerjee and ustad ali akbar khan who had a strong impact on krishnas musical growth while developing his own individual style krishnas music was greatly influenced by twentieth century stalwarts such as the vocalists amir khan bade gulam ali khan abdul karim khan begum akhtar shobha gurtu as well as folk singers of rajasthan krishnas repertoire in performance includes a wide variety of rare and old traditional compositions from these masters of musickrishna bhatt has received numerous awards and honors including the sangeet kalaratna jewel of music in 2009 he was also presented the gunijan award by the president of india mrs pratibha patil in 2005 and was conferred the kalashiroman samman by the maharaja of jodhpur shri gajsinghji and shri john singhji of jaipur virasat foundation in 2007 in rajasthan india krishna bhatt has been twice the recipient of the aiis fellowship awards in 1998 and 2004 in the category of performing artsin addition to performing hindustani classical music bhatt has also performed and recorded with the american composer terry riley working on the score for the alain tanner film no mans land zakir hussain the kronos quartet jody stecher jazz saxophonist george brooks and rajasthani folk musicianshe divides his time between jaipur rajasthan and new york city where he continues to perform and teach
Victor Crist,victor crist is a republican member of the florida senate representing the 12th district since 2001 he won his first term by beating democrat kathy castor in the general election previously he was a member of the florida house of representatives from 1992 through 2000crist serves as chair of the senates criminal and civil justice appropriations committee and as vice chair of the senates health policy committee crist known as an expert on criminal justice issues has served as an advisor on the topic to floridas attorney generalin the mid1990s crist founded the university area community development corporation in one of tampas more vulnerable communities crist now serves as ceo and volunteer chairman of the organization the university area community development corporation is a 501c3 charitable organization whose mission is to obtain the necessary resources support and direction to improve and sustain a thriving community where great social financial educational and healthrelated challenges exist in the pursuit of this mission the uacdc works to further strengthen hillsborough countys most socially and economically vulnerable neighborhoods through activities programs and services these range from operating a fully programmed stateoftheart community center complex to increasing economic development and affordable housing in the area we serve through innovative partnerships between public and private sectors as well as a wide range of service providers senator crist is of no relation to florida governor charlie cristsenator victor crist is a descendant of zachary taylor
Fabio Calzavara,fabio calzavara is an entrepreneur and venetian politician born in istrana on 21 september 1950 he is the cofounder of liga veneta 1980 a federalist party settled in padua veneto regionhe was a member of the board of european federalist union uef founded in zurich switzerland from 1982 till 1986 he was a member of the national council of the free autonomist entrepreneurs association alia from 1993 1994 and later on the free european federalist entrepreneurs association life from 1995 1997he was a member of the italian parliament and a foreign affairs committee member of camera dei deputati from 1996 2001 he was a member of the first interparliamentarian commission between italy and the russian federation from 1997 2001as an independent consultant he was accredited at the european parliament in bruxellesbrussels from 2003 2004he was also elected in the following local public administrationsmember of province council of treviso veneto region 1985 1990member of common house council of montebelluna veneto region 1987 1991member of common house council of melbelluno veneto region 1994 1998in december 2000 he participated in the first public humanitarian aid to iraq under the embargo organized by abbe pierre and jeanmarie benjamin on a special flight from paris to baghdad with 180 participants as parliamentarians diplomats journalists religious workers and ong volunteers from france italy switzerland the netherlands and great britainfrom 2005 he is working and living in moscow russian federation
Lauro Cavazos,lauro fred cavazos jr born january 4 1927 is a us educator and politician he served as secretary of education and was the first hispanic to serve in the united states cabineta sixthgeneration texan he was born on the king ranch near kingsville texas where his father served as foreman of the showcase santa gertrudis cattle division he was the son of lauro f cavazos sr and the former tomasa quintanilla through his maternal ancestry he is a descendant of texas revolution heroine francita alavez the angel of goliadhe earned ba and ma degrees in zoology from texas tech university and a phd in physiology from iowa state university in ames iowa while in college he was a member of kappa kappa psi following a stint on the faculties of tufts university and the medical college of virginia from 197580 he served as dean of the tufts university school of medicine from april 15 1980 to 1988 he served as president of texas tech university he was both the first alumnus and the first hispanic to serve as texas tech presidenta democrat cavazos served as secretary of education from august 1988 to december 1990 during the republican reagan and george h w bush administrations he was forced to resign amid an investigation into improper use of frequent flyer miles in december 1990following his resignation he returned to the faculty of tufts university where he is currently professor of public health and family medicine he is married to the former peggy ann murdock the couple has ten children and currently reside in boston massachusetts he is the brother of us army general richard e cavazos
Samuel Beniquez,samuel benquez mndez born 1971 in san juan puerto rico is a puerto rican best known for being nominated for an emmy award in year 2012 and as a plaintiff in an adoption law case that rose to the puerto rico supreme court he is the plaintiff in a widely reported court case to enforce his legitimacy rights against his alleged biological father the world leader of the pentecostal congregacin mita tefilo vargas senhis story is the subject of the book tu alto precio mi gran valor la vida de samuel beniquez el hijo de aarn by miguel amadeus and samuel ortiz ramos 2005 he has since built a successful career as a public relations agent and cofounder of advertising values for all as san juan pr and advertising agency on march 11 2013 at 750am aarn did the dna test the results of the dna test showed a positive result of 9999999 percent chance that teofilo vargas sein is his biological father the results were presented by judge arlene sells on march 25 2013 in the court of first instance superior chamber san juan puerto ricobeniquez was adopted by his maternal uncle and aunt flix benquez and ada mndez in 2004 this decision was appealed to the court of first instance of puerto rico for fraud and vitiated consent as were claimed beniquez natural mother always lived with him so the adoption in the light of the law never existed later on antonia married and left her aunt and uncles home with benquezbeniquez is an active member of the public relations society of america public relations society of puerto rico puerto rico manufacturers association licensed by the regulatory board of public relations professionals of puerto rico voting member of the latin academy of recording arts sciences and voting member of the national academy of recording arts sciences florida chapter member since 2002
Anna Zatonskih,anna zatonskih ukrainian born mariupol june 17 1978 is a chess player from the united states she is a woman grandmaster as well as an international master she is a chess professional who coaches players and competes in tournaments zatonskih is the 2006 2008 2009 and 2011 us womens chess championzatonskih learned chess at age five from her parents who are both strong players her father vitaly is rated about 2300 while her mother is a candidate master anna beat her mother for the first time at age 14anna won many ukrainian girls titles in several age categories she was awarded the wgm title in 1999 she twice won the ukrainian womens chess championship in 2001 and 2002 she represented ukraine in two chess olympiads at istanbul 2000 she scored 711 5 4 2 on board two and at bled 2002 she scored 357 2 3 2 on board threeshe represented the us in the chess olympiads of 2004 2006 and 2008 the americans won the team silver in 2004 their highest finish ever zatonskih won the united states womens championship in 2006 2008 2009 and 2011 in 2008 she beat the defending us womens chess champion irina krush by a single second under time control a moment that has been widelyviewed on the internet because of krushs reaction of smacking her king across the room in angershe is married to latvianborn grandmaster daniel fridman
Tamara Danilova,tamara danilova born july 30 1939 in leningrad ussr now known as st petersburg russia is a former soviet now russian athlete specializing in throwing events she competed for the soviet union at the 1972 summer olympics in the discus throw finishing fourth in the competition the winner of that competition was the world record holder faina melnyk but during the first round of the competition it was danilova who had set the new olympic record at 6264m surpassing the record of argentina menis set in qualifying two days earlier her record was brief as menis would improve the record two throws later and again in the fourth round only to have melnyk pass them all on the next throw to take the goldmelnyk would later go on to set the masters world record in the w35 division eight years later just after the moscow olympics danilova had to wait another sixteen years after the fall of the soviet union before she set her first masters world record in the w55 division in 1996 that record of 4336m still stands later danilova set the w65 3762m and w70 3380 world records that also still stand when she surpassed the w70 mark in 2009 it had previously been held by rosemary chrimes also a 1972 olympic finalist
Chung An-chi,chung anchi chinese pinyin zhng anq wadegiles chung anchi born july 23 1989 in taiwan better known in japan as anchii is the subleader of the latest hello project group ice creamusume she was announced as a winner of the taiwan hello project new star auditions on september 20 2008 along with the other members of ice creamusumehello project producer tsunku announced his plans to start a taiwanese audition in 2007 to find new talent to help the companys expansion into asia the winners would become a part of a new hello project group there were six winners including chung anchi and the group are set to debut in 2009 with their minialbum and at a hello project concertas she is the second oldest member she is automatically the subleader of the groupshe is a leoafter making it past the auditions and onto the live shows chung anchi was eliminated early but was brought back for a special episode in which tsunku allowed his favourite losers from the auditions and live shows to reaudition for the judges however she was eliminated during this episode once again and instead was sent to a last camp of sorts where she along with qiu cui ling was eventually chosen to join the group as one of tsunkus picks
Juliana Rotich,juliana rotich is an information technology professional who has developed web tools for crowdsourcing crisis information and coverage of topics related to the environment she is the executive director for ushahidi an opensource software project which uses crowdsourced geolocation mobile phone and web reporting data to provide crisis reporting and information ushahidi is the swahili word for testimony ushahidi was first put into practice during the kenyan presidential election crisis of 20078 it has since been used in chile japan new zealand australia pakistan tanzania and haitijuliana rotich is originally from kenya she has a degree in information technology from the university of missouri and has worked in the it industry for over ten years as a blogger she has authored articles on afrigadgetcom acted as environmental editor of global voices online and participated in the ted global conference in arusha in 2007 as a public speaker she is known for her commentary on technology in africa and voicing concerns about the loss of indigenous forest and water catchment areas in kenya she is a senior ted fellowin 2011 juliana rotich was named schwab foundation social entrepreneur of the year in africa by the world economic forumin 2014 rotich presented at the annual design indaba conference in cape town
Mary O\'Neill,mary oneill is a politician and former member of the legislative assembly of albertaoneill graduated from the university of toronto with a bachelor of arts and subsequently received her teaching certification from the ontario college of education she taught in both public and private schools after retiring from teaching she worked as a realtor and served as a school trustee with the greater st albert catholic schoolsin the 1997 provincial election oneill was the progressive conservative candidate in the riding of st albert where she faced liberal incumbent len bracko in the closest race of the election oneill defeated bracko by 16 votes in a rematch during the 2001 election oneill increased her lead over bracko to more than two thousand votes in her successful bid for reelectionin office oneill was best known for sponsoring the school trustee statutes amendment act 2002 which proposed to prohibit teachers from serving as school trustees anywhere in the province at the time teachers were only prohibited from serving as trustees in the district in which they taught the act was passed by the legislature but was struck down as contravening the charter of rights and freedoms by the alberta court of queens bench two years later oneill also served as a member of one of the ralph klein governments truth squads formed to defend the governments highly controversial health care protection act bill 11 she chaired the 2000 fees and charges review committee which made recommendations on a wide variety of governmentassessed feesin the 2004 provincial election oneill was defeated by liberal jack flaherty since her defeat she has served on the university of alberta senate on the northern alberta institute of technology board of governors and as the executive director of the glenrose rehabilitation hospital foundation she has remained politically active organizing the first debate of the 2006 progressive conservative leadership election and endorsing brent rathgeber in his bid to secure the conservative party of canada nomination in edmontonst albert in may 2007 oneill quelled speculation that she would run in the next provincial election stating that she wasnt interested
Tiger Woods,eldrick tont tiger woods born december 30 1975 is an american professional golfer who is among the most successful golfers of all time he has been one of the highestpaid athletes in the world for several yearswoods turned professional in 1996 and by april 1997 he had already won his first major the 1997 masters in a recordbreaking performance winning the tournament by 12 strokes and pocketing 486000 he first reached the number one position in the world rankings in june 1997 through the 2000s woods was the dominant force in golf spending 264 weeks from august 1999 to september 2004 and 281 weeks from june 2005 to october 2010 as world number one from december 2009 to early april 2010 woods took leave from professional golf to focus on his marriage after he admitted infidelity his many extramarital indescretions were revealed by several different women through many worldwide media sources this was followed by a loss of golf form and his ranking gradually fell to a low of no 58 in november 2011 he ended a careerhigh winless streak of 107 weeks when he captured the chevron world challenge in december 2011 after winning the arnold palmer invitational on march 25 2013 he ascended to the no1 ranking once again holding the top spot until may 2014woods has broken numerous golf records he has been world number one for the most consecutive weeks and for the greatest total number of weeks of any other golfer he has been awarded pga player of the year a record eleven times the byron nelson award for lowest adjusted scoring average a record eight times and has the record of leading the money list in ten different seasonshe has won 14 professional major golf championships the second highest of any player jack nicklaus leads with 18 and 79 pga tour events second all time behind sam snead who had 82 wins he has more career major wins and career pga tour wins than any other active golfer he is the youngest player to achieve the career grand slam and the youngest and fastest to win 50 tournaments on tour additionally woods is only the second golfer after jack nicklaus to have achieved a career grand slam three times woods has won 18 world golf championships and won at least one of those events in each of the first 11 years after they began in 1999 woods and rory mcilroy are the only golfers to win both the silver medal and the gold medal at the open championship
Vincy Chan,vincy chan born 16 october 1982 is a hong kong cantopop singer before the handover of 1997 when hong kong was returned from great britain to china her family left hong kong and went to singapore when she was a child she was signed by emperor entertainment group and debuted with the album vincy on 27 july 2006she attended the dunman high school in singapore chan was amongst the top 24 contestants in project superstar a singaporean singing competition held in june 2005 after graduating from nanyang technological university she was also the runnerup and won the award most popular image in emperor entertainment groups new talent singing awards in 2005 later on she became more wellknown amongst the hong kong public when her song my feelings chinese a cantonese rendition of freya lins debutedchan released the studio album flowers without snow chinese in february 2007 in which a song of eponymous title is the cantonese version of mika nakashimas yuki no hanain 2007 she performed at the success charity gala in vancouver british columbia canada with various artists chans latest album released october 15 2007 was titled close to you which included a cover version of the carpenters they long to be close to youafter the close to you tour ended at the beginning of 2008 vincy released her third and selftitled album on june 4 2008 this album also marks her first mandopop album since her only previous 2 albums featured cantonese popin 2008 vincy appeared in both new talent toronto june 21 and new talent calgary june 22 in canada at both occasions vincy performed her new hit mandarin song its very tiring to like a person and several other hits
Diane E. Beaver,diane e beaver is an american lawyer and former officer in the united states armyin october 2002 when beaver worked for the armys judge advocate general corps she drafted a legal opinion advocating for the legality of harsh interrogation techniques that were being proposed for use at guantanamo includingwaterboardingexposure to extremes of temperaturethe use of noninjurious physical contact andscenarios designed to convince the detainee that death or severely painful consequences are imminent for him andor his familyshe also advised that category ii and iii methods the harshest undergo a legal review prior to their commencementin a meeting in october 2002 beaver warned her fellow officers to make sure that observers from the international committee of the red cross icrc not observe the use of the harsher interrogation techniques the jtf might need to curb the harsher operations while icrc is around it would be better not to expose them to any controversial techniques they will be in and out scrutinizing our operations unless they are displeased and decide to protest and leave this would draw a lot of negative attentionafter leaving the army beaver was hired by the united states department of defensebeaver testified before the senate armed services committee on june 17 2008the final paragraph of the written statement she submitted to the committee readbeaver was one of the four individuals profiled in the 2009 documentary the guantanamo trap
Jimmy Kemp,jimmy kemp born june 27 1971 is a former cfl quarterback he is the brother of former nfl quarterback jeff kemp and the son of the late american football league most valuable player and us congressman jack kemp after a successful career at marylands winston churchill high school he played sparingly in his first two seasons at wake forest university including one as a redshirt before becoming the teams starter during his junior year after graduating he was signed by the sacramento gold miners of the canadian football league he was the teams third string quarterback behind david archer and kerwin bell before moving up to second string when bell left for the edmonton eskimos before the 1995 season he got his first start on july 26 1995 for the now san antonio texans when starter david archer went down he competed with former buffalo bills and tampa bay buccaneers starting quarterback joe ferguson for playing time until archer returned in late august in 1996 he split his time campaigning with his dad who was the republican party vice presidential nominee and playing football in 1998 when he once again replaced david archer as starter this time with the edmonton eskimos he split the toronto argonauts starting quarterback position with kerwin bell during the 2000 and 2001 cfl seasons before missing the entire 2002 season due to a contract hold out after the argonauts refused to pay his moving expenses
Simon Yeo,simon john yeo born 10 october 1973 in stockport england is an english former professional footballer who played as a forward from 1997 to 2011yeo a former member of the british army is most well known for his time at lincoln city where he spent two spells with the club between 2002 and 2006 yeo was part of the side managed by keith alexander that were defeated in the league two playoff final several times before his spells at sincil bank yeo had played in northern ireland for ards and coleraine at nonleague level for curzon ashton hyde united and atherton collieries in 2005 he left lincoln for the first time after he was scouted by newly formed aleague side new zealand knights and became one of the clubs marquee signings his stay was only brief and he had returned to lincoln only months later in 2006 he followed keith alexander firstly to peterborough united and later chester city bury and macclesfield town in 2009 he returned to nonleague football by joining conference north side droylsden before later joining harrogate town and new mills in 2011 he retired from competitive football but following the sudden death of alexander who was then manager of macclesfield he resigned for the club yeo went back into retirement a few months latersince retiring yeo has continued to keep close links with lincoln city and has appeared in several charity games
